{
  "Identifier": "MODIS_Combined_L3_IGBP_Land_Cover_Type_Annual",
  "Name": "MODIS_Combined_L3_IGBP_Land_Cover_Type_Annual",

  "VisualizationType": "tiles",

  "Title": "Land Cover Type (L3, IGBP, Annual, Best Available, MODIS, Aqua+Terra)",

  "Subtitle": "Aqua+Terra MODIS",
  "Description": "The Terra and Aqua combined Moderate Resolution Imaging Spectroradiometer (MODIS) Land Cover Type (MCD12Q1) Version 6 data product provides global land cover types at yearly intervals. The MCD12Q1 Version 6 data product is derived using supervised classifications of MODIS Terra and Aqua reflectance data. The supervised classifications then undergo additional post-processing that incorporate prior knowledge and ancillary information to further refine specific classes. This layer defines land cover type based on the International Geosphere-Biosphere Programme (IGBP) classification scheme. The classification legend and class descriptions are listed in section 5 of the User Guide",

  "ScienceKeywords": [
    {
      "Category": "EARTH SCIENCE",
      "Topic": "SPECTRAL/ENGINEERING",
      "Term": "tbd",
      "VariableLevel1": "tbd",
      "DetailedVariable": "tbd"
    },
    {
      "Category": "EARTH SCIENCE SERVICES",
      "Topic": "DATA ANALYSIS AND VISUALIZATION",
      "Term": "DATA VISUALIZATION",
      "VariableLevel1": "tbd"
    }
  ],

  "TemporalExtents": [
    {
      "RangeDateTimes": [
        {
          "BeginningDateTime": "2001-01-01T00:00:00.000Z",
          "EndingDateTime": "2019-12-31T23:59:59.999Z"
        }
      ]
    }
  ],

  "What": {

  "SupportsContinuousBrowsing": false,

  "Dimension": {
    "Current": "false",
    "Default": "2018-01-01",
    "Value": "2001-01-01/2018-01-01/P1Y",
    "ows:Identifier": "Time",
    "ows:UOM": "ISO8601"
  },
  "Format": "image/png",
  "ResourceURL": {
    "format": "image/png",
    "resourceType": "tile",
    "template": "https://gibs.earthdata.nasa.gov/wmts/epsg4326/best/MODIS_Combined_L3_IGBP_Land_Cover_Type_Annual/default/{Time}/{TileMatrixSet}/{TileMatrix}/{TileRow}/{TileCol}.png"
  },
  "LegendURL": [
    {
      "format": "image/svg+xml",
      "height": "288",
      "width": "288",
      "xlink:href": "https://gibs.earthdata.nasa.gov/legends/MODIS_IGBP_Land_Cover_Type_V.svg",
      "@xlink:role": "http://earthdata.nasa.gov/gibs/legend-type/vertical",
      "@xlink:title": "GIBS Color Map Legend: Vertical",
      "@xlink:type": "simple"
    },
    { "@format": "image/svg+xml",
      "@height": "270",
      "@width": "270",
      "@xlink:href": "https://gibs.earthdata.nasa.gov/legends/MODIS_IGBP_Land_Cover_Type_H.svg",
      "@xlink:role": "http://earthdata.nasa.gov/gibs/legend-type/horizontal",
      "@xlink:title": "GIBS Color Map Legend: Horizontal",
      "@xlink:type": "simple"
    }
  ],
  "Metadata": [
    {
      "@xlink:href": "https://gibs.earthdata.nasa.gov/colormaps/v1.3/MODIS_IGBP_Land_Cover_Type.xml",
      "@xlink:role": "http://earthdata.nasa.gov/gibs/metadata-type/colormap",
      "@xlink:title": "GIBS Color Map: Data - RGB Mapping",
      "@xlink:type": "simple"
    },
    {
      "@xlink:href": "https://gibs.earthdata.nasa.gov/colormaps/v1.0/MODIS_IGBP_Land_Cover_Type.xml",
      "@xlink:role": "http://earthdata.nasa.gov/gibs/metadata-type/colormap/1.0",
      "@xlink:title": "GIBS Color Map: Data - RGB Mapping",
      "@xlink:type": "simple"
    },
    {
      "@xlink:href": "https://gibs.earthdata.nasa.gov/colormaps/v1.3/MODIS_IGBP_Land_Cover_Type.xml",
      "@xlink:role": "http://earthdata.nasa.gov/gibs/metadata-type/colormap/1.3",
      "@xlink:title": "GIBS Color Map: Data - RGB Mapping",
      "@xlink:type": "simple"
    }
  ],
  "TileMatrixSetLink":
  {
    "TileMatrixSet": "500m"
  },
  "WGS84BoundingBox": {
    "crs": "urn:ogc:def:crs:OGC:2:84",
    "LowerCorner": [-180, -90],
    "UpperCorner": [180, 90]
  },

  "Ongoing": false,
  "measurement": "Land Cover",
  "RetentionPeriod": -1,
  "daynight": [
    "day"
  ],
  "layerPeriod": "Yearly"

  },

  "How": {
  },

  "ConceptIds": [
    {
      "type": "STD",
      "value": "C186286578-LPDAAC_ECS",
      "shortName": "MCD12Q1",
      "title": "MODIS/Terra+Aqua Land Cover Type Yearly L3 Global 500m SIN Grid V006",
      "version": "006",
      "dataCenter": "LPDAAC_ECS"
    }
  ],

  "MetadataSpecification": {
    "URL": "https://cdn.earthdata.nasa.gov/generics/visualization/v1.0.0",
    "Name": "Visualization",
    "Version": "1.0.0"
  }
}